<?xml version="1.0" encoding="UTF-8"?>

<gruposMusica
    xmlns:xsi="http://www.w3.org/2001/XMLSchema-instance"
    xsi:noNamespaceSchemaLocation="gruposMusica.xsd">

    <grupo>
        <nombre>Los Raperos</nombre>

        <genero>rap</genero>
        <genero>pop</genero>

        <contacto>
            <email>losraperos@correo.com</email>
            <facebook>facebook.com/losraperos</facebook>
            <instagram>instagram.com/losraperos</instagram>
            <twitter>twitter.com/losraperos</twitter>
        </contacto>

        <webOficial>https://www.losraperosoficial.com</webOficial>

        <integrantes>
            <integrante funcion="vocalista">
                <nombre>Pedro</nombre>
                <edad>25</edad>
            </integrante>
        </integrantes>
    </grupo>

    <grupo>
        <nombre>Los Cadillacs</nombre>

        <genero>folk</genero>

        <contacto>
            <email>loscadillacs@correo.com</email>
            <facebook>facebook.com/loscadillacs</facebook>
            <instagram>instagram.com/loscadillacs</instagram>
            <twitter>twitter.com/loscadillacs</twitter>
        </contacto>

        <webOficial>https://www.loscadillacsoficial.com</webOficial>

        <integrantes>
            <integrante funcion="vocalista">
                <nombre>Andres</nombre>
                <edad>36</edad>
            </integrante>
        </integrantes>
    </grupo>

</gruposMusica>